[
  {
    "name": "Dr. Farhat Khan",
    "speciality": "Dermatology",
    "qualification": "MBBS, MD, DNB (Dermatology, Venereology, and Leprosy)",
    "experience_years": null,
    "consultation_fee": null,
    "about": "Consultant Dermatologist and Venereologist specializing in dermatological therapies, skin allergies, and clinical dermatology.",
    "clinic": "Bansal Hospital",
    "address": "C-Sector, Shahpura",
    "city": "Bhopal",
    "state": "Madhya Pradesh",
    "phone": "+91-0755-4086000",
    "website": "https://bansalhospital.com",
    "source": "https://bansalhospital.com/doctors/dr-farhat-khan/",
    "verification_status": "pending"
  },
  {
    "name": "Dr. Akhilesh Agrawal",
    "speciality": "Dermatology",
    "qualification": "MBBS, DDVL, DNB (Dermatology & Venereology)",
    "experience_years": 19,
    "consultation_fee": null,
    "about": "Senior Consultant Dermatologist with 19 years of clinical experience in dermatology, venereology, and advanced skin care.",
    "clinic": "Apollo Sage Hospitals",
    "address": "E-8 Extension, Bawadiya Kalan",
    "city": "Bhopal",
    "state": "Madhya Pradesh",
    "phone": "0755-4308111",
    "website": "https://apollosage.in",
    "source": "https://apollosage.in/doctors/dr-akhilesh-agrawal",
    "verification_status": "pending"
  },
  {
    "name": "Dr. Rohini Singh Chauhan",
    "speciality": "Dermatology",
    "qualification": "MBBS, MD (Dermatology, Venereology & Leprosy)",
    "experience_years": null,
    "consultation_fee": null,
    "about": "Consultant Dermatologist specializing in clinical dermatology, venereology, and hair & skin disorder management.",
    "clinic": "Apollo Sage Hospitals",
    "address": "E-8 Extension, Bawadiya Kalan",
    "city": "Bhopal",
    "state": "Madhya Pradesh",
    "phone": "0755-4308111",
    "website": "https://apollosage.in",
    "source": "https://apollosage.in/doctors/dr-rohini-singh-chauhan",
    "verification_status": "pending"
  },
  {
    "name": "Dr. Rajbala Singh Bhadauria",
    "speciality": "ENT",
    "qualification": "MS (ENT)",
    "experience_years": null,
    "consultation_fee": null,
    "about": "Consultant ENT Surgeon specializing in ear, nose, throat, and sinus procedures.",
    "clinic": "Bansal Hospital",
    "address": "C-Sector, Shahpura",
    "city": "Bhopal",
    "state": "Madhya Pradesh",
    "phone": "+91-0755-4086000",
    "website": "https://bansalhospital.com",
    "source": "https://bansalhospital.com/doctors/dr-rajbala-singh-bhadauria/",
    "verification_status": "pending"
  },
  {
    "name": "Dr. Amit Ganguli",
    "speciality": "ENT",
    "qualification": "MS (ENT)",
    "experience_years": 38,
    "consultation_fee": null,
    "about": "Senior Consultant and Head of ENT with over 38 years of experience treating chronic sinusitis, hearing loss, and otolaryngology conditions.",
    "clinic": "Apollo Sage Hospitals",
    "address": "E-8 Extension, Bawadiya Kalan",
    "city": "Bhopal",
    "state": "Madhya Pradesh",
    "phone": "0755-4308111",
    "website": "https://apollosage.in",
    "source": "https://apollosage.in/doctors/dr-amit-ganguli",
    "verification_status": "pending"
  },
  {
    "name": "Dr. Ankit Mishra",
    "speciality": "ENT",
    "qualification": "MBBS, MS (ENT-HNS)",
    "experience_years": 4,
    "consultation_fee": null,
    "about": "ENT and Head & Neck Surgeon with expertise in rhinology, endonasal procedures, cochlear implants, vertigo, and sinus surgery.",
    "clinic": "Apollo Sage Hospitals",
    "address": "E-8 Extension, Bawadiya Kalan",
    "city": "Bhopal",
    "state": "Madhya Pradesh",
    "phone": "0755-4308111",
    "website": "https://apollosage.in",
    "source": "https://apollosage.in/doctors/dr-ankit-mishra",
    "verification_status": "pending"
  },
  {
    "name": "Dr. Ashima Malhotra",
    "speciality": "Dentistry",
    "qualification": "BDS, MDS (Prosthodontics)",
    "experience_years": null,
    "consultation_fee": null,
    "about": "Consultant Dental Surgeon and Prosthodontist specializing in dental prosthetics, restorative dentistry, and oral rehabilitation.",
    "clinic": "Bansal Hospital",
    "address": "C-Sector, Shahpura",
    "city": "Bhopal",
    "state": "Madhya Pradesh",
    "phone": "+91-0755-4086000",
    "website": "https://bansalhospital.com",
    "source": "https://bansalhospital.com/doctors/dr-ashima-malhotra/",
    "verification_status": "pending"
  },
  {
    "name": "Dr. Sana Khan",
    "speciality": "Dentistry",
    "qualification": "BDS, MDS (Conservative Dentistry and Endodontics)",
    "experience_years": null,
    "consultation_fee": null,
    "about": "Consultant Endodontist specializing in root canal therapy, cosmetic dental restorations, and conservative dentistry.",
    "clinic": "Bansal Hospital",
    "address": "C-Sector, Shahpura",
    "city": "Bhopal",
    "state": "Madhya Pradesh",
    "phone": "+91-0755-4086000",
    "website": "https://bansalhospital.com",
    "source": "https://bansalhospital.com/doctors/dr-sana-khan/",
    "verification_status": "pending"
  },
  {
    "name": "Dr. Richa Jain",
    "speciality": "Dentistry",
    "qualification": "BDS, MDS (Periodontology and Implantology)",
    "experience_years": 11,
    "consultation_fee": null,
    "about": "Consultant Dental Surgeon and Implantologist with over 11 years of experience in periodontics, implant dentistry, and oral care.",
    "clinic": "Apollo Sage Hospitals",
    "address": "E-8 Extension, Bawadiya Kalan",
    "city": "Bhopal",
    "state": "Madhya Pradesh",
    "phone": "0755-4308111",
    "website": "https://apollosage.in",
    "source": "https://apollosage.in/doctors/dr-richa-jain",
    "verification_status": "pending"
  },
  {
    "name": "Dr. Skand Kumar Trivedi",
    "speciality": "Cardiology",
    "qualification": "MBBS, MD, DM (Cardiology)",
    "experience_years": null,
    "consultation_fee": null,
    "about": "Director and Chief Interventional Cardiologist specializing in coronary interventions, complex angioplasty, and cardiac care.",
    "clinic": "Bansal Hospital",
    "address": "C-Sector, Shahpura",
    "city": "Bhopal",
    "state": "Madhya Pradesh",
    "phone": "+91-0755-4086000",
    "website": "https://bansalhospital.com",
    "source": "https://bansalhospital.com/doctors/dr-skand-kumar-trivedi/",
    "verification_status": "pending"
  },
  {
    "name": "Dr. Arohi Jain",
    "speciality": "Cardiology",
    "qualification": "MBBS, MD, DrNB (Cardiology)",
    "experience_years": null,
    "consultation_fee": null,
    "about": "Consultant Cardiologist specializing in clinical cardiology, cardiovascular diagnostics, echocardiography, and heart failure.",
    "clinic": "Bansal Hospital",
    "address": "C-Sector, Shahpura",
    "city": "Bhopal",
    "state": "Madhya Pradesh",
    "phone": "+91-0755-4086000",
    "website": "https://bansalhospital.com",
    "source": "https://bansalhospital.com/doctors/dr-arohi-jain/",
    "verification_status": "pending"
  },
  {
    "name": "Dr. Atit Gawalkar",
    "speciality": "Cardiology",
    "qualification": "MBBS, MD, DM (Cardiology)",
    "experience_years": null,
    "consultation_fee": null,
    "about": "Consultant Interventional Cardiologist specializing in angiography, angioplasty, pacemaker implantation, and cardiac intensive care.",
    "clinic": "Bansal Hospital",
    "address": "C-Sector, Shahpura",
    "city": "Bhopal",
    "state": "Madhya Pradesh",
    "phone": "+91-0755-4086000",
    "website": "https://bansalhospital.com",
    "source": "https://bansalhospital.com/doctors/dr-atit-gawalkar/",
    "verification_status": "pending"
  },
  {
    "name": "Dr. Chandra Kumar Singh",
    "speciality": "Cardiology",
    "qualification": null,
    "experience_years": null,
    "consultation_fee": null,
    "about": "Interventional Cardiologist specializing in coronary angiography, complex angioplasty, and cardiac interventions.",
    "clinic": "Apollo Sage Hospitals",
    "address": "E-8 Extension, Bawadiya Kalan",
    "city": "Bhopal",
    "state": "Madhya Pradesh",
    "phone": "0755-4308111",
    "website": "https://apollosage.in",
    "source": "https://apollosage.in/doctors/dr-chandra-kumar-singh",
    "verification_status": "pending"
  },
  {
    "name": "Dr. Ajit Verma",
    "speciality": "Neurology",
    "qualification": "MBBS, MD, DM (Neurology)",
    "experience_years": null,
    "consultation_fee": null,
    "about": "Senior Consultant Neurologist specializing in stroke management, epilepsy, neuromuscular disorders, and clinical neurology.",
    "clinic": "Bansal Hospital",
    "address": "C-Sector, Shahpura",
    "city": "Bhopal",
    "state": "Madhya Pradesh",
    "phone": "+91-0755-4086000",
    "website": "https://bansalhospital.com",
    "source": "https://bansalhospital.com/doctors/dr-ajit-verma/",
    "verification_status": "pending"
  },
  {
    "name": "Dr. Prateek Sharma",
    "speciality": "Neurology",
    "qualification": "MBBS, MD, DM (Neurology)",
    "experience_years": null,
    "consultation_fee": null,
    "about": "Consultant Neurologist specializing in neuro-critical care, headaches, vertigo, and movement disorders.",
    "clinic": "Bansal Hospital",
    "address": "C-Sector, Shahpura",
    "city": "Bhopal",
    "state": "Madhya Pradesh",
    "phone": "+91-0755-4086000",
    "website": "https://bansalhospital.com",
    "source": "https://bansalhospital.com/doctors/dr-prateek-sharma/",
    "verification_status": "pending"
  },
  {
    "name": "Dr. Pankaj Singh",
    "speciality": "Neurology",
    "qualification": "MBBS, MD, DNB (Neurology)",
    "experience_years": null,
    "consultation_fee": null,
    "about": "Consultant Neurologist specializing in comprehensive neurological consultations, peripheral neuropathies, and stroke rehabilitation.",
    "clinic": "Bansal Hospital",
    "address": "C-Sector, Shahpura",
    "city": "Bhopal",
    "state": "Madhya Pradesh",
    "phone": "+91-0755-4086000",